{
  "contract_version": "enterprise-submission-capabilities-v1",
  "service_id": "mineguard-regulatory-intake",
  "server_time": "2026-07-27T08:00:00Z",
  "supported_submission_contracts": [
    {
      "version": "enterprise-submission-v1",
      "status": "current",
      "schema_uri": "/contracts/schemas/enterprise-submission-v1.schema.json",
      "submission_path": "/v1/enterprise-submissions"
    }
  ],
  "authentication": {
    "scheme": "hmac-sha256",
    "signature_version": "hmac-sha256-v1",
    "timestamp_tolerance_seconds": 300,
    "nonce_retention_seconds": 600
  },
  "limits": {
    "max_body_bytes": 10485760,
    "max_observations": 10000
  },
  "integrity_algorithms": {
    "submission_payload": "sha-256+rfc8785-jcs",
    "transport_body": "sha-256+raw-http-body",
    "observation_signature": "mineguard-governed-observation-hmac-sha256-v1"
  },
  "features": {
    "field_provenance_required": true,
    "human_confirmation_required": true,
    "llm_disclosure_required": true,
    "regulatory_classification_at_intake": false
  }
}
